<?xml version="1.0" encoding="UTF-8" standalone="no"?>
<!DOCTYPE kmeter-skin SYSTEM "include/dtd/kmeter-skin.dtd">
<?xml-stylesheet type="text/xsl" href="include/xslt/skin_svg.xslt"?>

<kmeter-skin
	name="Legacy"
	orientation="vertical"
	path="legacy"
	version="1.0">

	<default>
		<button_k20
			x="130"
			y="10"
			width="60"
			height="20"
			image_on="buttons/button_k20_on.png"
			image_off="buttons/button_k20_off.png"
		/>

		<button_k14
			x="130"
			y="35"
			width="60"
			height="20"
			image_on="buttons/button_k14_on.png"
			image_off="buttons/button_k14_off.png"
		/>

		<button_k12
			x="130"
			y="60"
			width="60"
			height="20"
			image_on="buttons/button_k12_on.png"
			image_off="buttons/button_k12_off.png"
		/>

		<button_normal
			x="130"
			y="85"
			width="60"
			height="20"
			image_on="buttons/button_normal_on.png"
			image_off="buttons/button_normal_off.png"
		/>

		<button_itu
			x="130"
			y="125"
			width="60"
			height="20"
			image_on="buttons/button_itu_on.png"
			image_off="buttons/button_itu_off.png"
		/>

		<button_rms
			x="130"
			y="150"
			width="60"
			height="20"
			image_on="buttons/button_rms_on.png"
			image_off="buttons/button_rms_off.png"
		/>

		<button_hold
			x="130"
			y="190"
			width="60"
			height="20"
			image_on="buttons/button_hold_on.png"
			image_off="buttons/button_hold_off.png"
		/>

		<button_peaks
			x="130"
			y="215"
			width="60"
			height="20"
			image_on="buttons/button_peaks_on.png"
			image_off="buttons/button_peaks_off.png"
		/>

		<button_expand
			x="130"
			y="240"
			width="60"
			height="20"
			image_on="buttons/button_expand_on.png"
			image_off="buttons/button_expand_off.png"
		/>

		<button_skin
			x="130"
			y="265"
			width="60"
			height="20"
			image_on="buttons/button_skin_on.png"
			image_off="buttons/button_skin_off.png"
		/>

		<button_mono
			x="130"
			y="305"
			width="60"
			height="20"
			image_on="buttons/button_mono_on.png"
			image_off="buttons/button_mono_off.png"
		/>

		<button_reset
			x="130"
			y="330"
			width="60"
			height="20"
			image_on="buttons/button_reset_on.png"
			image_off="buttons/button_reset_off.png"
		/>

		<button_validate
			x="130"
			y="592"
			width="60"
			height="20"
			image_on="buttons/button_validate_on.png"
			image_off="buttons/button_validate_off.png"
		/>

		<button_about
			x="130"
			y="617"
			width="60"
			height="20"
			image_on="buttons/button_about_on.png"
			image_off="buttons/button_about_off.png"
		/>

		<label_debug
			x="138"
			y="560"
			width="44"
			height="11"
			image="labels/label_debug.png"
		/>
	</default>

	<stereo_itu>
		<meter_phase_correlation
			x="10"
			y="624"
			width="107"
			height="13"
			spacing_left="1"
			spacing_top="1"
			image="meters/meter_phase_correlation.png"
			>
			<needle
				width="3"
				height="11"
				image="meters/meter_phase_correlation_needle.png"
			/>
		</meter_phase_correlation>

		<meter_stereo
			x="10"
			y="607"
			width="107"
			height="13"
			spacing_left="1"
			spacing_top="1"
			image="meters/meter_stereo.png"
			>
			<needle
				width="3"
				height="11"
				image="meters/meter_stereo_needle.png"
			/>
		</meter_stereo>

		<label_over
			x="47"
			y="14"
			width="32"
			height="16"
			spacing_left="3"
			spacing_top="2"
			font_size="12"
			image_on="labels/label_over_on.png"
			image_off="labels/label_over_off.png"
		/>

		<label_peak
			x="47"
			y="32"
			width="32"
			height="16"
			spacing_left="3"
			spacing_top="2"
			font_size="12"
			image_on="labels/label_peak_on.png"
			image_off="labels/label_peak_off.png"
		/>
	</stereo_itu>

	<stereo_itu_k20>
		<background
			width="200"
			height="648"
			image_no_peaks="backgrounds/background_stereo_itu_k20_no-peaks.png"
			image_peaks="backgrounds/background_stereo_itu_k20_peaks.png"
			image_expanded_no_peaks="backgrounds/background_stereo_itu_k20_expanded_no-peaks.png"
			image_expanded_peaks="backgrounds/background_stereo_itu_k20_expanded_peaks.png"
		/>

		<meter_kmeter
			x="51"
			y="58"
			width="24"
			height="537"
			image="meters/meter_kmeter_itu_k20.png"
			image_expanded="meters/meter_kmeter_itu_k20_expanded.png"
		/>
	</stereo_itu_k20>

	<stereo_itu_k14>
		<background
			width="200"
			height="648"
			image_no_peaks="backgrounds/background_stereo_itu_k14_no-peaks.png"
			image_peaks="backgrounds/background_stereo_itu_k14_peaks.png"
			image_expanded_no_peaks="backgrounds/background_stereo_itu_k14_expanded_no-peaks.png"
			image_expanded_peaks="backgrounds/background_stereo_itu_k14_expanded_peaks.png"
		/>

		<meter_kmeter
			x="51"
			y="58"
			width="24"
			height="537"
			image="meters/meter_kmeter_itu_k14.png"
			image_expanded="meters/meter_kmeter_itu_k14_expanded.png"
		/>
	</stereo_itu_k14>

	<stereo_itu_k12>
		<background
			width="200"
			height="648"
			image_no_peaks="backgrounds/background_stereo_itu_k12_no-peaks.png"
			image_peaks="backgrounds/background_stereo_itu_k12_peaks.png"
			image_expanded_no_peaks="backgrounds/background_stereo_itu_k12_expanded_no-peaks.png"
			image_expanded_peaks="backgrounds/background_stereo_itu_k12_expanded_peaks.png"
		/>

		<meter_kmeter
			x="51"
			y="58"
			width="24"
			height="537"
			image="meters/meter_kmeter_itu_k12.png"
			image_expanded="meters/meter_kmeter_itu_k12_expanded.png"
		/>
	</stereo_itu_k12>

	<stereo_itu_normal>
		<background
			width="200"
			height="648"
			image_no_peaks="backgrounds/background_stereo_itu_normal_no-peaks.png"
			image_peaks="backgrounds/background_stereo_itu_normal_peaks.png"
			image_expanded_no_peaks="backgrounds/background_stereo_itu_normal_expanded_no-peaks.png"
			image_expanded_peaks="backgrounds/background_stereo_itu_normal_expanded_peaks.png"
		/>

		<meter_kmeter
			x="51"
			y="58"
			width="24"
			height="537"
			image="meters/meter_kmeter_itu_normal.png"
			image_expanded="meters/meter_kmeter_itu_normal_expanded.png"
		/>
	</stereo_itu_normal>

	<stereo_rms>
		<meter_phase_correlation
			x="10"
			y="624"
			width="107"
			height="13"
			spacing_left="1"
			spacing_top="1"
			image="meters/meter_phase_correlation.png"
			>
			<needle
				width="3"
				height="11"
				image="meters/meter_phase_correlation_needle.png"
			/>
		</meter_phase_correlation>

		<meter_stereo
			x="10"
			y="607"
			width="107"
			height="13"
			spacing_left="1"
			spacing_top="1"
			image="meters/meter_stereo.png"
			>
			<needle
				width="3"
				height="11"
				image="meters/meter_stereo_needle.png"
			/>
		</meter_stereo>

		<label_over_left
			x="15"
			y="14"
			width="32"
			height="16"
			spacing_left="3"
			spacing_top="2"
			font_size="12"
			image_on="labels/label_over_on.png"
			image_off="labels/label_over_off.png"
		/>

		<label_over_right
			x="79"
			y="14"
			width="32"
			height="16"
			spacing_left="3"
			spacing_top="2"
			font_size="12"
			image_on="labels/label_over_on.png"
			image_off="labels/label_over_off.png"
		/>

		<label_peak_left
			x="15"
			y="32"
			width="32"
			height="16"
			spacing_left="3"
			spacing_top="2"
			font_size="12"
			image_on="labels/label_peak_on.png"
			image_off="labels/label_peak_off.png"
		/>

		<label_peak_right
			x="79"
			y="32"
			width="32"
			height="16"
			spacing_left="3"
			spacing_top="2"
			font_size="12"
			image_on="labels/label_peak_on.png"
			image_off="labels/label_peak_off.png"
		/>
	</stereo_rms>

	<stereo_rms_k20>
		<background
			width="200"
			height="648"
			image_no_peaks="backgrounds/background_stereo_rms_k20_no-peaks.png"
			image_peaks="backgrounds/background_stereo_rms_k20_peaks.png"
			image_expanded_no_peaks="backgrounds/background_stereo_rms_k20_expanded_no-peaks.png"
			image_expanded_peaks="backgrounds/background_stereo_rms_k20_expanded_peaks.png"
		/>

		<meter_kmeter_left
			x="19"
			y="58"
			width="20"
			height="537"
			image="meters/meter_kmeter_rms_k20.png"
			image_expanded="meters/meter_kmeter_rms_k20_expanded.png"
		/>

		<meter_kmeter_right
			x="87"
			y="58"
			width="20"
			height="537"
			image="meters/meter_kmeter_rms_k20.png"
			image_expanded="meters/meter_kmeter_rms_k20_expanded.png"
		/>
	</stereo_rms_k20>

	<stereo_rms_k14>
		<background
			width="200"
			height="648"
			image_no_peaks="backgrounds/background_stereo_rms_k14_no-peaks.png"
			image_peaks="backgrounds/background_stereo_rms_k14_peaks.png"
			image_expanded_no_peaks="backgrounds/background_stereo_rms_k14_expanded_no-peaks.png"
			image_expanded_peaks="backgrounds/background_stereo_rms_k14_expanded_peaks.png"
		/>

		<meter_kmeter_left
			x="19"
			y="58"
			width="20"
			height="537"
			image="meters/meter_kmeter_rms_k14.png"
			image_expanded="meters/meter_kmeter_rms_k14_expanded.png"
		/>

		<meter_kmeter_right
			x="87"
			y="58"
			width="20"
			height="537"
			image="meters/meter_kmeter_rms_k14.png"
			image_expanded="meters/meter_kmeter_rms_k14_expanded.png"
		/>
	</stereo_rms_k14>

	<stereo_rms_k12>
		<background
			width="200"
			height="648"
			image_no_peaks="backgrounds/background_stereo_rms_k12_no-peaks.png"
			image_peaks="backgrounds/background_stereo_rms_k12_peaks.png"
			image_expanded_no_peaks="backgrounds/background_stereo_rms_k12_expanded_no-peaks.png"
			image_expanded_peaks="backgrounds/background_stereo_rms_k12_expanded_peaks.png"
		/>

		<meter_kmeter_left
			x="19"
			y="58"
			width="20"
			height="537"
			image="meters/meter_kmeter_rms_k12.png"
			image_expanded="meters/meter_kmeter_rms_k12_expanded.png"
		/>

		<meter_kmeter_right
			x="87"
			y="58"
			width="20"
			height="537"
			image="meters/meter_kmeter_rms_k12.png"
			image_expanded="meters/meter_kmeter_rms_k12_expanded.png"
		/>
	</stereo_rms_k12>

	<stereo_rms_normal>
		<background
			width="200"
			height="648"
			image_no_peaks="backgrounds/background_stereo_rms_normal_no-peaks.png"
			image_peaks="backgrounds/background_stereo_rms_normal_peaks.png"
			image_expanded_no_peaks="backgrounds/background_stereo_rms_normal_expanded_no-peaks.png"
			image_expanded_peaks="backgrounds/background_stereo_rms_normal_expanded_peaks.png"
		/>